{
  "$schema": "http://json-schema.org/draft-07/schema#",
  "title": "Playwright MCP Configuration",
  "description": "Configuration schema for Playwright Model Context Protocol server",
  "type": "object",
  "properties": {
    "browser": {
      "type": "object",
      "description": "Browser configuration options",
      "properties": {
        "browserName": {
          "type": "string",
          "enum": ["chromium", "firefox", "webkit"],
          "description": "The type of browser to use"
        },
        "isolated": {
          "type": "boolean",
          "description": "Keep the browser profile in memory, do not save it to disk"
        },
        "userDataDir": {
          "type": "string",
          "description": "Path to a user data directory for browser profile persistence. Temporary directory is created by default"
        },
        "launchOptions": {
          "type": "object",
          "description": "Launch options passed to Playwright browser launch",
          "properties": {
            "headless": {
              "type": "boolean",
              "description": "Whether to run browser in headless mode"
            },
            "channel": {
              "type": "string",
              "description": "Browser channel to use"
            },
            "executablePath": {
              "type": "string",
              "description": "Path to browser executable"
            },
            "args": {
              "type": "array",
              "items": {
                "type": "string"
              },
              "description": "Additional arguments to pass to the browser instance"
            },
            "timeout": {
              "type": "number",
              "description": "Maximum time in milliseconds to wait for the browser instance to start"
            }
          },
          "additionalProperties": true
        },
        "contextOptions": {
          "type": "object",
          "description": "Context options for the browser context",
          "properties": {
            "viewport": {
              "type": "object",
              "properties": {
                "width": {
                  "type": "number"
                },
                "height": {
                  "type": "number"
                }
              },
              "additionalProperties": false
            },
            "userAgent": {
              "type": "string",
              "description": "User agent string"
            },
            "locale": {
              "type": "string",
              "description": "Locale for the browser context"
            },
            "timezone": {
              "type": "string",
              "description": "Timezone for the browser context"
            }
          },
          "additionalProperties": true
        },
        "cdpEndpoint": {
          "type": "string",
          "description": "Chrome DevTools Protocol endpoint to connect to an existing browser instance in case of Chromium family browsers"
        },
        "remoteEndpoint": {
          "type": "string",
          "description": "Remote endpoint to connect to an existing Playwright server"
        }
      },
      "additionalProperties": false
    },
    "server": {
      "type": "object",
      "description": "Server configuration options",
      "properties": {
        "port": {
          "type": "number",
          "description": "The port to listen on for SSE or MCP transport",
          "minimum": 1,
          "maximum": 65535
        },
        "host": {
          "type": "string",
          "description": "The host to bind the server to. Default is localhost. Use 0.0.0.0 to bind to all interfaces"
        }
      },
      "additionalProperties": false
    },
    "capabilities": {
      "type": "array",
      "description": "List of enabled tool capabilities",
      "items": {
        "type": "string",
        "enum": ["core", "core-tabs", "core-install", "vision", "pdf"],
        "description": "Tool capability"
      },
      "uniqueItems": true
    },
    "saveTrace": {
      "type": "boolean",
      "description": "Whether to save the Playwright trace of the session into the output directory"
    },
    "outputDir": {
      "type": "string",
      "description": "The directory to save output files"
    },
    "network": {
      "type": "object",
      "description": "Network configuration options",
      "properties": {
        "allowedOrigins": {
          "type": "array",
          "items": {
            "type": "string"
          },
          "description": "List of origins to allow the browser to request. Default is to allow all. Origins matching both allowedOrigins and blockedOrigins will be blocked"
        },
        "blockedOrigins": {
          "type": "array",
          "items": {
            "type": "string"
          },
          "description": "List of origins to block the browser to request. Origins matching both allowedOrigins and blockedOrigins will be blocked"
        }
      },
      "additionalProperties": false
    },
    "imageResponses": {
      "type": "string",
      "enum": ["allow", "omit", "auto"],
      "description": "Whether to send image responses to the client. Can be 'allow', 'omit', or 'auto'. Defaults to 'auto', which sends images if the client can display them"
    }
  },
  "additionalProperties": false
}
